{
  "specimen": "py-03-ledger-api",
  "language": "python",
  "kind": "web",
  "summary": "In-memory double-entry ledger API with accounts, fee-bearing transfers and paginated statements.",
  "defects": [
    {
      "id": "PY03-D01",
      "file": "ledger.py",
      "function": "transfer",
      "line": 88,
      "anchor": "src_balance - amount - FEE_CENTS",
      "class": "bug",
      "category": "missing-precondition",
      "cwe": "CWE-20",
      "title": "Transfers never require a positive amount",
      "description": "transfer() applies amount without checking it is positive, so a negative amount moves money from the destination into the source.",
      "trigger": "POST /transfer {\"from\": c, \"to\": d, \"amount_cents\": -50}",
      "observed": "The source gains 25 (50 minus fee) and the destination loses 50; the request returns 200.",
      "repro": "negative_transfer"
    },
    {
      "id": "PY03-D02",
      "file": "ledger.py",
      "function": "transfer",
      "line": 82,
      "anchor": "if not can_cover(src.balance_cents, amount):",
      "class": "bug",
      "category": "invariant-violation",
      "cwe": "CWE-682",
      "title": "Balance check ignores the transfer fee",
      "description": "can_cover is consulted against the bare amount, but the debit is amount + FEE_CENTS, so spending the whole balance leaves it negative by the fee.",
      "trigger": "POST /transfer of 100 from an account holding exactly 100",
      "observed": "Source balance becomes -25.",
      "repro": "fee_overdraft"
    },
    {
      "id": "PY03-D03",
      "file": "ledger.py",
      "function": "close_account",
      "line": 103,
      "anchor": "acc.entries.append(closing_entry(account_id, moved))",
      "class": "bug",
      "category": "invalid-state-transition",
      "cwe": "CWE-841",
      "title": "An already-closed account can be closed again",
      "description": "close_account never checks acc.closed, so a second close records another closing entry on a closed account.",
      "trigger": "POST /close {\"id\": N} twice",
      "observed": "The statement contains two entries of kind 'close'.",
      "repro": "double_close"
    },
    {
      "id": "PY03-D04",
      "file": "ledger.py",
      "function": "transfer",
      "line": 87,
      "anchor": "self._persist_journal",
      "class": "design",
      "category": "race-condition",
      "cwe": "CWE-362",
      "title": "Transfer balance updates are lost under concurrency",
      "description": "transfer reads balances, flushes the journal (with latency), then writes back the computed values; concurrent transfers under the threaded server overwrite each other.",
      "trigger": "50 parallel POST /transfer of 1 cent from an account holding 1000",
      "observed": "The source ends at 974 instead of -300; the house account likewise loses fee credits.",
      "repro": "transfer_lost_update"
    },
    {
      "id": "PY03-D05",
      "file": "ledger.py",
      "function": "page",
      "line": 23,
      "anchor": "entries[offset:][:limit]",
      "class": "bug",
      "category": "out-of-bounds",
      "cwe": "CWE-129",
      "title": "Statement pagination accepts negative offsets",
      "description": "page slices entries[offset:][:limit] without validating offset, so a negative offset returns the tail of the statement instead of an error or an empty page.",
      "trigger": "GET /statement/<id>?offset=-2&limit=10",
      "observed": "Returns the last 2 entries of a 4-entry statement.",
      "repro": "negative_page_offset"
    },
    {
      "id": "PY03-D06",
      "file": "ledger.py",
      "function": "transfer",
      "line": 90,
      "anchor": "if dst is None:",
      "class": "bug",
      "category": "invariant-violation",
      "cwe": "CWE-682",
      "title": "A failed destination leg keeps the sender debit",
      "description": "transfer debits the source and credits the fee before looking up the destination; when the destination does not exist it raises after the debit, so the amount is destroyed rather than rolled back.",
      "trigger": "POST /transfer to a nonexistent account id",
      "observed": "The API returns 404 but the total of all balances drops by the transferred amount.",
      "repro": "debit_without_rollback"
    },
    {
      "id": "PY03-D07",
      "file": "app.py",
      "function": "show_account",
      "line": 92,
      "anchor": "acc = LEDGER.get(account_id)",
      "class": "vulnerability",
      "category": "idor",
      "cwe": "CWE-639",
      "title": "Account and statement reads ignore the caller identity",
      "description": "show_account and the statement endpoints return any sequential account id without comparing it to the X-Owner header.",
      "trigger": "GET /accounts/<id> with another user's X-Owner",
      "observed": "HTTP 200 returning the other user's account.",
      "repro": "cross_owner_read"
    },
    {
      "id": "PY03-D08",
      "file": "app.py",
      "function": "statement_html",
      "line": 127,
      "anchor": "Statement: {acc.label}",
      "class": "vulnerability",
      "category": "xss",
      "cwe": "CWE-79",
      "title": "Account label is rendered unescaped in the HTML statement",
      "description": "statement_html interpolates acc.label into the page, so a label containing markup is emitted raw.",
      "trigger": "Create an account labelled '<script>alert(1)</script>' and GET /statement/<id>.html",
      "observed": "The response body contains the script tag verbatim.",
      "repro": "label_xss"
    },
    {
      "id": "PY03-D09",
      "file": "ledger.py",
      "function": "create_account",
      "line": 75,
      "anchor": "setattr(acc, key, value)",
      "class": "vulnerability",
      "category": "mass-assignment",
      "cwe": "CWE-915",
      "title": "Account creation copies every request field onto the account",
      "description": "create_account applies all JSON keys via setattr, so a client can set balance_cents directly and bypass the 10000-cent initial deposit cap.",
      "trigger": "POST /accounts {\"initial_cents\": 50, \"balance_cents\": 1000000}",
      "observed": "The account is created with balance_cents 1000000.",
      "repro": "field_smuggling"
    },
    {
      "id": "PY03-D10",
      "file": "app.py",
      "function": "do_transfer",
      "line": 102,
      "anchor": "LEDGER.transfer(src_id, dst_id, amount)",
      "class": "vulnerability",
      "category": "missing-authorization",
      "cwe": "CWE-862",
      "title": "Transfers debit 'from' without checking the caller owns it",
      "description": "do_transfer never compares the X-Owner header with the source account owner, so anyone can move money out of any account.",
      "trigger": "POST /transfer with X-Owner of a different user",
      "observed": "HTTP 200 and the victim's balance is debited.",
      "repro": "unowned_debit"
    }
  ]
}
