{
  "specimen": "ts-03-invoice-cli",
  "language": "typescript",
  "kind": "cli",
  "summary": "Invoice calculator CLI: reads line items from JSON, applies discount and tax, prints or writes a text/JSON invoice.",
  "defects": [
    {
      "id": "TS03-D01",
      "file": "pricing.ts",
      "function": "subtotal",
      "line": 55,
      "anchor": "sum += lineTotal(item);",
      "class": "design",
      "category": "float-money",
      "cwe": "CWE-681",
      "title": "Money accumulated as binary floating point",
      "description": "Amounts are JavaScript numbers and subtotal() sums them in a loop, so totals carry binary rounding error that leaks into the JSON export and later comparisons.",
      "trigger": "Three items at 0.10, --json",
      "observed": "subtotal is 0.30000000000000004.",
      "repro": "float_subtotal"
    },
    {
      "id": "TS03-D02",
      "file": "invoice.ts",
      "function": "renderInvoice",
      "line": 79,
      "anchor": "money(taxAmount(totals.subtotal, opts.tax))",
      "class": "bug",
      "category": "logic-error",
      "cwe": null,
      "title": "Printed tax line computed before discount",
      "description": "renderInvoice() prints tax on the undiscounted subtotal while computeTotals() charges tax on the discounted net, so the printed lines do not add up to the Total.",
      "trigger": "One item at 100, --tax 10 --discount 10",
      "observed": "Subtotal 100, Discount -10, Tax 10.00 but Total 99.00.",
      "repro": "tax_line_mismatch"
    },
    {
      "id": "TS03-D03",
      "file": "pricing.ts",
      "function": "effectiveTaxRate",
      "line": 79,
      "anchor": "return (tax / net) * 100;",
      "class": "bug",
      "category": "division-by-zero",
      "cwe": "CWE-369",
      "title": "Effective tax rate divides by a zero net amount",
      "description": "effectiveTaxRate() divides by the net amount, which is 0 when the discount is 100% (or there are no items).",
      "trigger": "--discount 100",
      "observed": "Invoice prints 'Effective tax rate: NaN%'.",
      "repro": "full_discount_nan"
    },
    {
      "id": "TS03-D04",
      "file": "pricing.ts",
      "function": "parseItem",
      "line": 27,
      "anchor": "if (!Number.isInteger(r.quantity)) throw",
      "class": "bug",
      "category": "missing-precondition",
      "cwe": "CWE-20",
      "title": "Negative quantities accepted",
      "description": "parseItem() only checks that quantity is an integer, so negative (and zero) quantities pass and credit the invoice.",
      "trigger": "items.json with {\"quantity\": -3}",
      "observed": "Exit 0 and a negative subtotal.",
      "repro": "negative_quantity"
    },
    {
      "id": "TS03-D05",
      "file": "pricing.ts",
      "function": "pageFooters",
      "line": 89,
      "anchor": "const last = items[page * perPage + perPage - 1];",
      "class": "bug",
      "category": "out-of-bounds",
      "cwe": "CWE-125",
      "title": "Page footer reads past the end of the item list",
      "description": "pageFooters() assumes every page is full; on a partial last page the index is beyond items.length and last.sku dereferences undefined.",
      "trigger": "An invoice with 12 items (two pages of 10)",
      "observed": "Exit 1: Cannot read properties of undefined (reading 'sku').",
      "repro": "page_footer_oob"
    },
    {
      "id": "TS03-D06",
      "file": "invoice.ts",
      "function": "invoiceId",
      "line": 61,
      "anchor": "createHash(\"md5\").update(`${customer}:${date}`)",
      "class": "vulnerability",
      "category": "weak-crypto",
      "cwe": "CWE-328",
      "title": "Invoice ids are an MD5 of guessable inputs",
      "description": "invoiceId() hashes only customer and date with MD5, so ids are predictable by anyone and two invoices for the same customer on the same day collide.",
      "trigger": "Two different item files, same --customer and --date",
      "observed": "Both get the same id, equal to md5('Globex:2026-10-01') truncated.",
      "repro": "md5_invoice_id"
    },
    {
      "id": "TS03-D07",
      "file": "invoice.ts",
      "function": "writeInvoice",
      "line": 89,
      "anchor": "execSync(\"cat \" + path",
      "class": "vulnerability",
      "category": "command-injection",
      "cwe": "CWE-78",
      "title": "Output path passed to a shell",
      "description": "writeInvoice() verifies the written file with execSync('cat ' + path), so shell metacharacters in --out run arbitrary commands.",
      "trigger": "--out 'inv.txt;touch pwned.flag'",
      "observed": "pwned.flag is created in the working directory.",
      "repro": "out_command_injection"
    },
    {
      "id": "TS03-D08",
      "file": "pricing.ts",
      "function": "parseItems",
      "line": 41,
      "anchor": "} catch {",
      "class": "design",
      "category": "error-handling",
      "cwe": "CWE-390",
      "title": "Invalid line items silently dropped",
      "description": "parseItems() catches every parse error and skips the item without reporting it, so a malformed entry disappears from the invoice while the CLI exits 0.",
      "trigger": "An item with \"unitPrice\": \"1299.00\" (string)",
      "observed": "Exit 0, no warning, the item is missing from the invoice and totals.",
      "repro": "bad_item_skipped"
    },
    {
      "id": "TS03-D09",
      "file": "pricing.ts",
      "function": "applyDiscount",
      "line": 62,
      "anchor": "return amount - (amount * percent) / 100;",
      "class": "bug",
      "category": "missing-precondition",
      "cwe": "CWE-20",
      "title": "Discounts above 100% produce negative totals",
      "description": "applyDiscount() and parseArgs() never bound percent to 0..100, so a discount of 150 yields a negative net and total.",
      "trigger": "--discount 150",
      "observed": "Total is negative and the CLI exits 0.",
      "repro": "discount_over_100"
    },
    {
      "id": "TS03-D10",
      "file": "pricing.ts",
      "function": "taxAmount",
      "line": 67,
      "anchor": "return Math.floor(amount * ratePercent) / 100;",
      "class": "bug",
      "category": "rounding-error",
      "cwe": "CWE-682",
      "title": "Tax truncated instead of rounded to cents",
      "description": "taxAmount() floors to whole cents, systematically under-charging tax (1.999 becomes 1.99).",
      "trigger": "One item at 19.99, --tax 10 --json",
      "observed": "tax is 1.99 instead of 2.00.",
      "repro": "tax_truncated"
    }
  ]
}
