{
  "specimen": "rs-02-kv-server",
  "language": "rust",
  "kind": "web",
  "summary": "Tiny HTTP key-value server on std::net, thread per connection, shared maps for values and counters, snapshot files under a data dir.",
  "defects": [
    {
      "id": "RS02-D01",
      "file": "src/main.rs",
      "function": "read_request",
      "line": 106,
      "anchor": "let target = parts[1].to_string();",
      "class": "bug",
      "category": "out-of-bounds",
      "cwe": null,
      "title": "Request line indexed without a length check",
      "description": "The request line is split on whitespace and parts[1] is indexed unconditionally, so a request line with no path panics the handler thread.",
      "trigger": "send 'GET\\r\\n\\r\\n'",
      "observed": "handler thread panics (index out of bounds), client sees an empty reply while the server keeps serving.",
      "repro": "bad_request_line"
    },
    {
      "id": "RS02-D02",
      "file": "src/main.rs",
      "function": "read_request",
      "line": 118,
      "anchor": "body.extend(std::iter::repeat(0).take(content_len));",
      "class": "vulnerability",
      "category": "unbounded-resource",
      "cwe": "CWE-400",
      "title": "Body buffer sized by caller-supplied Content-Length",
      "description": "read_request allocates content_len bytes with no cap, so a single request header can force a multi-hundred-MiB resident allocation.",
      "trigger": "PUT with 'Content-Length: 536870912' and a tiny body",
      "observed": "server VmRSS jumps from ~2 MB to ~526 MB while the client sends almost nothing.",
      "repro": "huge_body"
    },
    {
      "id": "RS02-D03",
      "file": "src/main.rs",
      "function": "incr",
      "line": 39,
      "anchor": "let mut map = state.counters.lock().unwrap();",
      "class": "bug",
      "category": "race-condition",
      "cwe": "CWE-362",
      "title": "Counter increment is a non-atomic read-modify-write",
      "description": "incr reads the counter under the mutex, drops the guard, computes, then re-locks to write back, so concurrent increments lose updates.",
      "trigger": "16 concurrent threads x 100 increments of the same counter",
      "observed": "final counter below the expected 1600 (observed 1586-1594 across runs).",
      "repro": "lost_updates"
    },
    {
      "id": "RS02-D04",
      "file": "src/main.rs",
      "function": "snapshot",
      "line": 53,
      "anchor": "let path = data_dir().join(dest);",
      "class": "vulnerability",
      "category": "path-traversal",
      "cwe": "CWE-22",
      "title": "Snapshot path joined onto data dir unchecked",
      "description": "snapshot joins the caller-supplied path onto the data dir without normalising or rejecting '..', so a crafted path writes the snapshot anywhere the process can write.",
      "trigger": "POST /snapshot?path=../../<name>.snap",
      "observed": "snapshot file lands outside the data directory.",
      "repro": "snapshot_traversal"
    },
    {
      "id": "RS02-D05",
      "file": "src/main.rs",
      "function": "incr",
      "line": 38,
      "anchor": "let next = current + delta;",
      "class": "bug",
      "category": "integer-overflow",
      "cwe": null,
      "title": "i32 counter addition wraps silently",
      "description": "Counters are i32 and the caller-supplied delta is added with plain '+', which wraps silently in the release profile.",
      "trigger": "incr with delta=2147483647, then delta=10",
      "observed": "counter wraps to -2147483639 (release profile arithmetic).",
      "repro": "counter_wrap"
    },
    {
      "id": "RS02-D06",
      "file": "src/main.rs",
      "function": "normalize_key",
      "line": 29,
      "anchor": "String::from_utf8_lossy(&bytes[..budget])",
      "class": "bug",
      "category": "logic-error",
      "cwe": null,
      "title": "Byte-budget key truncation collides distinct keys",
      "description": "normalize_key truncates keys at a fixed byte budget and repairs invalid UTF-8 with from_utf8_lossy, so distinct keys that share the truncated prefix (e.g. differing only past byte 32) map to the same stored key.",
      "trigger": "PUT two keys sharing their first 32 bytes, GET the first",
      "observed": "GET returns the second key's value: the keys collided.",
      "repro": "key_collision"
    },
    {
      "id": "RS02-D07",
      "file": "src/main.rs",
      "function": "keys_with_prefix",
      "line": 47,
      "anchor": "&k[..prefix.len()] == prefix",
      "class": "bug",
      "category": "error-handling",
      "cwe": null,
      "title": "Prefix slice panics under the lock and poisons the mutex",
      "description": "keys_with_prefix slices each key at the caller's prefix length while holding the kv mutex; a prefix ending mid-codepoint panics, and every other handler's lock().unwrap() then fails forever.",
      "trigger": "PUT kv/a%C3%A9, then GET /keys?prefix=ab, then GET /kv/a%C3%A9 again",
      "observed": "the poison request panics the handler; all later requests fail (curl rc=52, empty reply) until restart.",
      "repro": "poisoned_mutex"
    },
    {
      "id": "RS02-D08",
      "file": "src/main.rs",
      "function": "read_request",
      "line": 88,
      "anchor": "let n = stream.read(&mut buf)?;",
      "class": "design",
      "category": "resource-leak",
      "cwe": "CWE-400",
      "title": "Connections have no read timeout",
      "description": "read_request blocks on read() with no deadline, so a client that sends a partial request and stalls holds its handler thread forever.",
      "trigger": "open 16 sockets, send a partial request line on each, stall",
      "observed": "server thread count grows 1 -> 17 and stays high while the clients stall.",
      "repro": "stalled_threads"
    },
    {
      "id": "RS02-D09",
      "file": "src/main.rs",
      "function": "handle",
      "line": 231,
      "anchor": "if token != ADMIN_TOKEN {",
      "class": "vulnerability",
      "category": "hardcoded-secret",
      "cwe": "CWE-798",
      "title": "Admin flush token hardcoded in source",
      "description": "POST /admin/flush compares the caller's token against a compiled-in constant, so anyone who can read the binary/source can flush the store.",
      "trigger": "POST /admin/flush?token=kv-s3cr3t-flush",
      "observed": "flush succeeds and stored keys return 404 afterwards.",
      "repro": "admin_token"
    },
    {
      "id": "RS02-D10",
      "file": "src/main.rs",
      "function": "handle",
      "line": 221,
      "anchor": "snapshot {} failed: {e}",
      "class": "vulnerability",
      "category": "information-exposure",
      "cwe": "CWE-209",
      "title": "Error responses leak filesystem paths and raw io errors",
      "description": "The snapshot error path puts the absolute on-disk path and the raw io::Error into the 500 response body.",
      "trigger": "POST /snapshot?path=x.snap with an unwritable data dir",
      "observed": "500 body contains 'snapshot /proc/.../x.snap failed: ... (os error 2)'.",
      "repro": "error_leaks_path"
    },
    {
      "id": "RS02-D11",
      "file": "src/main.rs",
      "function": "handle",
      "line": 227,
      "anchor": "format!(\"{PAGE}<div>key: {key}</div>\")",
      "class": "vulnerability",
      "category": "xss",
      "cwe": "CWE-79",
      "title": "/ui echoes query value into HTML unescaped",
      "description": "The ui handler interpolates the caller's key parameter into a text/html response with no escaping, so markup is reflected verbatim.",
      "trigger": "GET /ui?key=%3Cscript%3Ealert(1)%3C/script%3E",
      "observed": "the response body contains <script>alert(1)</script> verbatim with Content-Type text/html.",
      "repro": "reflected_xss"
    }
  ]
}