{
  "specimen": "rs-01-bank-core",
  "language": "rust",
  "kind": "cli",
  "summary": "Banking ledger core and CLI: accounts in integer cents, queued transfers with settlement, daily spend limits, fees, interest and statements, persisted to a text state file.",
  "defects": [
    {
      "id": "RS01-D01",
      "file": "src/bank.rs",
      "function": "accrue_interest",
      "line": 31,
      "anchor": "(balance_cents as f64 * rate_bp as f64 / 10_000.0) as i64",
      "class": "bug",
      "category": "float-money",
      "cwe": null,
      "title": "Interest computed in f64 truncates cents",
      "description": "accrue_interest converts the cent balance to f64 before multiplying, so large balances lose representable precision and the truncation drops a cent versus exact integer arithmetic.",
      "trigger": "interest on an account holding 9388934101589121 cents at 500 bp",
      "observed": "credits 469446705079455 cents while exact integer math gives 469446705079456.",
      "repro": "float_interest"
    },
    {
      "id": "RS01-D02",
      "file": "src/bank.rs",
      "function": "remaining_daily_allowance",
      "line": 35,
      "anchor": "limit_cents.wrapping_sub(spent_cents)",
      "class": "bug",
      "category": "integer-underflow",
      "cwe": null,
      "title": "Daily allowance underflows when spent exceeds limit",
      "description": "remaining_daily_allowance subtracts spent from limit with wrapping_sub; once fees push spent_today above the limit the allowance wraps to ~1.8e19 and every later transfer passes the daily-limit check.",
      "trigger": "open with limit 500, charge a 600-cent fee, then statement / transfer",
      "observed": "statement prints remaining_daily_allowance 18446744073709551516; a 5000-cent transfer is approved (release profile, wraps silently).",
      "repro": "wrapped_allowance"
    },
    {
      "id": "RS01-D03",
      "file": "src/bank.rs",
      "function": "request_transfer",
      "line": 85,
      "anchor": "if src.balance_cents < amount_cents",
      "class": "bug",
      "category": "missing-precondition",
      "cwe": null,
      "title": "Transfer accepts negative amounts",
      "description": "request_transfer only checks balance >= amount, so a negative amount always passes and at settlement moves money from the destination into the source.",
      "trigger": "transfer a b -500 && settle",
      "observed": "a goes 1000->1500 and b goes 2000->1500 after transferring -500.",
      "repro": "negative_transfer"
    },
    {
      "id": "RS01-D04",
      "file": "src/bank.rs",
      "function": "split_payment",
      "line": 39,
      "anchor": "amount_cents / recipients.len() as i64",
      "class": "bug",
      "category": "division-by-zero",
      "cwe": null,
      "title": "Split divides by empty recipient list",
      "description": "split_payment divides the amount by recipients.len() with no empty check, so an empty recipient list panics on integer division by zero.",
      "trigger": "split 1000 (no recipients)",
      "observed": "process panics with 'attempt to divide by zero', exit 101.",
      "repro": "empty_split"
    },
    {
      "id": "RS01-D05",
      "file": "src/bank.rs",
      "function": "account_at",
      "line": 52,
      "anchor": "&self.accounts[index]",
      "class": "bug",
      "category": "out-of-bounds",
      "cwe": null,
      "title": "Account index used without bounds check",
      "description": "account_at indexes self.accounts with a CLI-supplied index and no length check.",
      "trigger": "account-at 99 with one account open",
      "observed": "index out of bounds panic, exit 101.",
      "repro": "index_oob"
    },
    {
      "id": "RS01-D06",
      "file": "src/bank.rs",
      "function": "request_transfer",
      "line": 92,
      "anchor": "src.spent_today_cents = 0;",
      "class": "bug",
      "category": "invariant-violation",
      "cwe": null,
      "title": "Rejected transfer resets the daily spend counter",
      "description": "The running spend total is reset inside the over-limit rejection branch instead of on a day change, so alternating an accepted and a rejected transfer lets total settled spend exceed the daily limit.",
      "trigger": "limit 1000; transfer 600, 600 (rejected), 600; settle",
      "observed": "1200 cents settle against a daily limit of 1000.",
      "repro": "limit_bypass"
    },
    {
      "id": "RS01-D07",
      "file": "src/bank.rs",
      "function": "close_account",
      "line": 124,
      "anchor": "acct.closed = true;",
      "class": "design",
      "category": "invalid-state-transition",
      "cwe": null,
      "title": "Closing an account leaves queued transfers that settle into it",
      "description": "close_account only flips the closed flag; pending transfers referencing the account stay queued and settle() credits a closed account.",
      "trigger": "transfer a b 400; close b; settle",
      "observed": "closed account b changes 500->900.",
      "repro": "settle_closed"
    },
    {
      "id": "RS01-D08",
      "file": "src/bank.rs",
      "function": "record_audit",
      "line": 153,
      "anchor": "self.audit.push(entry)",
      "class": "design",
      "category": "unbounded-resource",
      "cwe": "CWE-400",
      "title": "Audit log grows without bound",
      "description": "record_audit appends to the in-memory audit Vec on every operation and nothing trims it; the history-lines constant is only used to limit statement display.",
      "trigger": "batch of 5000 deposits, then audit-count",
      "observed": "audit entries=5001 and the state file grows to ~70 KB; entries are never dropped.",
      "repro": "audit_growth"
    },
    {
      "id": "RS01-D09",
      "file": "src/main.rs",
      "function": "parse_cents",
      "line": 14,
      "anchor": "arg.parse::<i64>().unwrap()",
      "class": "bug",
      "category": "error-handling",
      "cwe": null,
      "title": "Amount parsing unwraps user input",
      "description": "parse_cents unwraps the CLI parse result, so a non-numeric amount panics instead of producing a usage error.",
      "trigger": "deposit a xyz",
      "observed": "panic 'called `Result::unwrap()` on an `Err` value', exit 101.",
      "repro": "bad_amount"
    },
    {
      "id": "RS01-D10",
      "file": "src/main.rs",
      "function": "operator_token",
      "line": 18,
      "anchor": "env::var(\"BANK_OPERATOR_TOKEN\").unwrap_or_else(|_| OPERATOR_TOKEN.to_string())",
      "class": "vulnerability",
      "category": "hardcoded-secret",
      "cwe": "CWE-798",
      "title": "Operator token hardcoded in source",
      "description": "The privileged adjust/close commands compare --token against OPERATOR_TOKEN (env override falls back to the compiled-in constant), so anyone who can read the binary/source can run operator commands.",
      "trigger": "adjust a 5000 --token bk-7f3a1c9e-ops",
      "observed": "adjust succeeds with the built-in token, balance 100->5100.",
      "repro": "default_token"
    },
    {
      "id": "RS01-D11",
      "file": "src/main.rs",
      "function": "write_statement",
      "line": 63,
      "anchor": "let path = Path::new(REPORTS_DIR).join(file_name);",
      "class": "vulnerability",
      "category": "path-traversal",
      "cwe": "CWE-22",
      "title": "Statement --out joins user path onto reports dir",
      "description": "write_statement joins the --out name onto reports/ without normalising or rejecting '..', so a crafted name writes the statement outside the reports directory.",
      "trigger": "statement a --out ../../<name>.txt",
      "observed": "statement file is written to a directory outside reports/.",
      "repro": "report_traversal"
    },
    {
      "id": "RS01-D12",
      "file": "src/bank.rs",
      "function": "charge_fee",
      "line": 132,
      "anchor": "acct.spent_today_cents += cents as u64",
      "class": "bug",
      "category": "missing-precondition",
      "cwe": "CWE-20",
      "title": "Fees are not required to be non-negative",
      "description": "charge_fee never checks cents >= 0, so a negative fee credits the account and makes spent_today_cents wrap around u64.",
      "trigger": "fee a -300",
      "observed": "balance goes 1000->1300 and spent_today_cents wraps to 18446744073709551316.",
      "repro": "negative_fee"
    }
  ]
}
