{
  "specimen": "sol-01-token-vault",
  "language": "solidity",
  "kind": "contract",
  "summary": "ERC20-style token plus an ETH vault with pro-rata shares, withdraw fees and reward distribution.",
  "defects": [
    {
      "id": "SOL01-D01",
      "file": "src/RewardVault.sol",
      "function": "withdraw",
      "line": 94,
      "anchor": "_payout(msg.sender, net);",
      "class": "vulnerability",
      "category": "reentrancy",
      "cwe": "CWE-841",
      "title": "Withdraw pays out before updating share accounting",
      "description": "withdraw() sends the net ETH payout (and pending rewards) via external call before rewards are zeroed and shares are burned, so a contract receiver can re-enter and be paid the same rewards and principal again.",
      "trigger": "A contract receiver calls withdraw(); its receive() re-enters withdraw() while the payout call is in flight.",
      "observed": "Receiver is paid ~22.2 ETH against a 15 ETH entitlement (10 ETH deposit + 5 ETH rewards).",
      "repro": "reentrant_withdraw"
    },
    {
      "id": "SOL01-D02",
      "file": "src/VaultToken.sol",
      "function": "transferFrom",
      "line": 60,
      "anchor": "allowance[from][msg.sender] -= amount;",
      "class": "vulnerability",
      "category": "integer-underflow",
      "cwe": "CWE-191",
      "title": "transferFrom decrements allowance without checking it",
      "description": "The allowance decrement runs inside an unchecked block with no allowance >= amount guard, so a spender with zero allowance can move a victim's tokens and the allowance wraps to ~2^256.",
      "trigger": "spender calls transferFrom(victim, spender, 60e18) with no approval.",
      "observed": "60 tokens move from the victim and the recorded allowance wraps to 2^256-60.",
      "repro": "allowance_underflow"
    },
    {
      "id": "SOL01-D03",
      "file": "src/RewardVault.sol",
      "function": "sharePrice",
      "line": 76,
      "anchor": "totalAssets() * 1e18 / totalShares",
      "class": "bug",
      "category": "division-by-zero",
      "cwe": "CWE-369",
      "title": "sharePrice divides by totalShares with no zero guard",
      "description": "sharePrice() computes totalAssets() * 1e18 / totalShares; on an empty vault totalShares is 0 and the call reverts with Panic 0x12.",
      "trigger": "Call sharePrice() before any deposit.",
      "observed": "Staticcall reverts with panic code 0x12 (division by zero).",
      "repro": "share_price_empty"
    },
    {
      "id": "SOL01-D04",
      "file": "src/RewardVault.sol",
      "function": "_sharesFor",
      "line": 154,
      "anchor": "return assets * totalShares / totalAssets();",
      "class": "design",
      "category": "rounding-error",
      "cwe": "CWE-682",
      "title": "First-depositor share inflation zeros later deposits",
      "description": "The first depositor can mint 1 share for 1 wei and then donate ETH via receive(); a subsequent 1 ETH deposit mints shares that round to 0 and is still accepted, letting the first depositor redeem the victim's ETH.",
      "trigger": "deposit() 1 wei, send 10 ETH to the vault directly, then a victim deposits 1 ETH.",
      "observed": "Victim is minted 0 shares; the 1-wei first depositor withdraws ~11 ETH.",
      "repro": "first_depositor_inflation"
    },
    {
      "id": "SOL01-D05",
      "file": "src/RewardVault.sol",
      "function": "setFeeRecipient",
      "line": 124,
      "anchor": "function setFeeRecipient(address who) external",
      "class": "vulnerability",
      "category": "access-control",
      "cwe": "CWE-284",
      "title": "setFeeRecipient has no owner check",
      "description": "Anyone can call setFeeRecipient and redirect all future withdraw fees to an arbitrary address.",
      "trigger": "outsider calls setFeeRecipient(outsider).",
      "observed": "feeRecipient becomes the caller's address.",
      "repro": "fee_recipient_anyone"
    },
    {
      "id": "SOL01-D06",
      "file": "src/RewardVault.sol",
      "function": "setWithdrawFeeBps",
      "line": 130,
      "anchor": "require(tx.origin == owner",
      "class": "vulnerability",
      "category": "tx-origin-auth",
      "cwe": "CWE-346",
      "title": "Admin setter authorizes on tx.origin",
      "description": "setWithdrawFeeBps checks tx.origin == owner, so any contract the owner transacts with can call back in and set the fee up to MAX_FEE_BPS.",
      "trigger": "Owner calls a third-party contract that invokes vault.setWithdrawFeeBps(1000) in the same transaction.",
      "observed": "withdrawFeeBps becomes 1000 (10%) through the proxied call.",
      "repro": "tx_origin_admin"
    },
    {
      "id": "SOL01-D07",
      "file": "src/RewardVault.sol",
      "function": "_payFee",
      "line": 168,
      "anchor": "(bool sent, ) = feeRecipient.call{value: fee}(\"\");",
      "class": "bug",
      "category": "unchecked-call",
      "cwe": "CWE-252",
      "title": "Fee transfer return value is ignored",
      "description": "_payFee ignores the success of the low-level call to feeRecipient; when the recipient reverts on receive, the withdraw succeeds, the user is charged the fee, and the fee simply stays in the vault.",
      "trigger": "feeRecipient is a contract that reverts on receive; a holder withdraws with a 10% fee.",
      "observed": "User receives 9 ETH (1 ETH fee deducted) while the fee recipient holds 0 ETH.",
      "repro": "fee_transfer_ignored"
    },
    {
      "id": "SOL01-D08",
      "file": "src/RewardVault.sol",
      "function": "deposit",
      "line": 57,
      "anchor": "pos.shares += uint128(shares);",
      "class": "bug",
      "category": "integer-overflow",
      "cwe": "CWE-197",
      "title": "Per-account shares truncated into a uint128 slot",
      "description": "deposit() packs shares into a uint128 via an unchecked downcast; a deposit of 2^128 + x wei mints 2^128 + x shares but records only x for the account.",
      "trigger": "Deposit 2^128 + 1000 wei into an empty vault.",
      "observed": "sharesOf(depositor) returns 1000 while the deposit was 2^128 + 1000 wei.",
      "repro": "share_truncation"
    },
    {
      "id": "SOL01-D09",
      "file": "src/RewardVault.sol",
      "function": "distributeRewards",
      "line": 108,
      "anchor": "for (uint256 i = 0; i < holders.length; i++)",
      "class": "design",
      "category": "denial-of-service",
      "cwe": "CWE-400",
      "title": "Reward distribution loops an unbounded holder list",
      "description": "deposit() pushes to holders on every call including duplicates, and distributeRewards iterates all entries; with ~1000 entries a call capped at 3,000,000 gas runs out of gas.",
      "trigger": "200 depositors each deposit 1 wei 5 times, then owner calls distributeRewards with a 3M gas cap.",
      "observed": "holders.length is 1000 and the distribution call fails (out of gas).",
      "repro": "reward_holder_loop"
    },
    {
      "id": "SOL01-D10",
      "file": "src/RewardVault.sol",
      "function": "distributeRewards",
      "line": 107,
      "anchor": "uint256 perShare = msg.value / totalShares;",
      "class": "bug",
      "category": "rounding-error",
      "cwe": "CWE-682",
      "title": "Reward per share computed by dividing before scaling",
      "description": "distributeRewards computes perShare = msg.value / totalShares and multiplies afterwards, so any reward smaller than totalShares accrues 0 to every holder and the ETH stays stranded in the vault.",
      "trigger": "Two holders with 10 ETH deposits; owner distributes 1e15 wei.",
      "observed": "rewards(holder) is 0 and the full 1e15 wei is stranded in totalAssets.",
      "repro": "reward_divide_first"
    }
  ]
}