{
  "specimen": "rs-03-matrix-tool",
  "language": "rust",
  "kind": "cli",
  "summary": "CLI that reads a whitespace-separated integer matrix and runs ops: invert, mean, scale, transpose, report, checksum.",
  "defects": [
    {
      "id": "RS03-D01",
      "file": "src/main.rs",
      "function": "at",
      "line": 44,
      "anchor": "self.data[row * self.rows + col]",
      "class": "bug",
      "category": "out-of-bounds",
      "cwe": null,
      "title": "Cell index uses row count as the stride",
      "description": "at() computes the flat index with `row * self.rows + col`, using rows where cols is the stride. On non-square matrices it reads the wrong cells and panics outright on some shapes.",
      "trigger": "report on a 2x3 matrix",
      "observed": "per-column totals read col0=4 col1=6 col2=8 instead of 5/7/9.",
      "repro": "swapped_stride"
    },
    {
      "id": "RS03-D02",
      "file": "src/main.rs",
      "function": "mean",
      "line": 53,
      "anchor": "sum / (self.rows * self.cols) as i32",
      "class": "bug",
      "category": "division-by-zero",
      "cwe": null,
      "title": "Mean divides by cells count with no empty check",
      "description": "mean() divides by rows*cols directly, so an empty input panics on integer division by zero.",
      "trigger": "mean on an empty file",
      "observed": "'attempt to divide by zero' panic, exit 101.",
      "repro": "empty_mean"
    },
    {
      "id": "RS03-D03",
      "file": "src/main.rs",
      "function": "invert2x2",
      "line": 88,
      "anchor": "Ok(vec![d / det, -b / det, -c / det, a / det])",
      "class": "bug",
      "category": "division-by-zero",
      "cwe": null,
      "title": "Inversion divides by determinant with no near-zero check",
      "description": "invert2x2 divides each cofactor by the determinant without checking it is non-zero, so a singular matrix produces inf/-inf output.",
      "trigger": "invert on '1 2 / 2 4'",
      "observed": "prints 'inf -inf -inf inf'.",
      "repro": "singular_invert"
    },
    {
      "id": "RS03-D04",
      "file": "src/main.rs",
      "function": "scale",
      "line": 60,
      "anchor": "self.data.iter().map(|v| v * factor).collect()",
      "class": "bug",
      "category": "integer-overflow",
      "cwe": null,
      "title": "Cell scaling multiplies i32 with plain '*'",
      "description": "scale() multiplies i32 cells by the factor with '*', which wraps silently in the release profile.",
      "trigger": "scale a 1500000000 cell by 2",
      "observed": "prints -1294967296 (release profile wrap).",
      "repro": "scale_wrap"
    },
    {
      "id": "RS03-D05",
      "file": "src/main.rs",
      "function": "parse_cells",
      "line": 19,
      "anchor": "tok.parse::<i32>().unwrap()",
      "class": "bug",
      "category": "error-handling",
      "cwe": null,
      "title": "Cell parser unwraps user input",
      "description": "parse_cells unwraps the i32 parse of every token, so a non-numeric cell panics instead of reporting a parse error.",
      "trigger": "input containing cell 'x'",
      "observed": "unwrap panic, exit 101.",
      "repro": "bad_cell"
    },
    {
      "id": "RS03-D06",
      "file": "src/main.rs",
      "function": "load_matrix",
      "line": 36,
      "anchor": "data.extend(cells.iter().take(cols));",
      "class": "design",
      "category": "logic-error",
      "cwe": null,
      "title": "Row width taken from the first row only",
      "description": "load_matrix fixes cols from the first row and truncates every later row to that width, so ragged input silently loses cells.",
      "trigger": "rows '1 2' then '3 4 5 6'",
      "observed": "cells 5 and 6 are silently dropped; matrix reported as 2x2.",
      "repro": "ragged_rows"
    },
    {
      "id": "RS03-D07",
      "file": "src/main.rs",
      "function": "main",
      "line": 196,
      "anchor": "m.scale(factor as i32)",
      "class": "bug",
      "category": "logic-error",
      "cwe": null,
      "title": "u32 factor flips sign when cast to i32",
      "description": "--factor is parsed as u32 and passed through `as i32`, so a factor above i32::MAX silently becomes negative.",
      "trigger": "scale --factor 3000000000 on cell 7",
      "observed": "prints -474836480 instead of 21000000000 / an error.",
      "repro": "factor_sign"
    },
    {
      "id": "RS03-D08",
      "file": "src/main.rs",
      "function": "transpose",
      "line": 66,
      "anchor": "for c in 0..self.cols - 1",
      "class": "bug",
      "category": "off-by-one",
      "cwe": null,
      "title": "Transpose loop drops the last column",
      "description": "transpose() iterates columns over 0..cols-1, dropping the final column of the input.",
      "trigger": "transpose a 2x3 matrix",
      "observed": "output is 2x2, the last source column is missing.",
      "repro": "transpose_drop"
    },
    {
      "id": "RS03-D09",
      "file": "src/main.rs",
      "function": "append_report",
      "line": 117,
      "anchor": "let cmd = format!(\"echo '{}: {}' >> {}\", label, body, summary_path);",
      "class": "vulnerability",
      "category": "command-injection",
      "cwe": "CWE-78",
      "title": "Report label interpolated into a shell command",
      "description": "append_report builds an `sh -c` command string embedding the caller's --label and --out values verbatim, so quote-breaking input runs arbitrary commands.",
      "trigger": "report --label \"x'; touch /tmp/<mark>; echo '\"",
      "observed": "the marker file is created by the injected command.",
      "repro": "label_injection"
    },
    {
      "id": "RS03-D10",
      "file": "src/main.rs",
      "function": "checksum_file",
      "line": 95,
      "anchor": "acc.wrapping_add(*b as u32)",
      "class": "vulnerability",
      "category": "weak-crypto",
      "cwe": "CWE-328",
      "title": "Integrity check is an additive byte sum",
      "description": "checksum_file folds the file bytes into a u32 with wrapping_add, so any permutation of the same bytes collides.",
      "trigger": "checksum files '1 2\\n3 4' and '2 1\\n4 3'",
      "observed": "two different inputs produce the same checksum.",
      "repro": "checksum_collision"
    },
    {
      "id": "RS03-D11",
      "file": "src/main.rs",
      "function": "write_cache",
      "line": 113,
      "anchor": "let _ = fs::write(cache, text);",
      "class": "vulnerability",
      "category": "toctou",
      "cwe": "CWE-367",
      "title": "Results cached to a predictable path without create_new",
      "description": "write_cache writes to the fixed world-visible path /tmp/matrix_tool_cache.txt, following symlinks, so a pre-placed symlink makes the tool overwrite an attacker-chosen file.",
      "trigger": "symlink the cache path to a victim file, then run any op",
      "observed": "the victim file is overwritten with the cached result.",
      "repro": "cache_symlink"
    }
  ]
}
