{
  "specimen": "ts-02-url-shortener",
  "language": "typescript",
  "kind": "web",
  "summary": "URL shortener API with aliases, expiry, click statistics, link previews and an admin delete endpoint.",
  "defects": [
    {
      "id": "TS02-D01",
      "file": "links.ts",
      "function": "generateCode",
      "line": 36,
      "anchor": "return Math.random().toString(36).slice(2, 2 + CODE_LENGTH);",
      "class": "vulnerability",
      "category": "insecure-randomness",
      "cwe": "CWE-338",
      "title": "Short codes derived from Math.random",
      "description": "generateCode() builds codes from Math.random(), a non-cryptographic PRNG whose output is predictable, so private links can be enumerated or predicted.",
      "trigger": "Call generateCode() with Math.random pinned to a fixed value",
      "observed": "The code is a pure function of Math.random(): the same value yields the same code.",
      "repro": "code_from_math_random"
    },
    {
      "id": "TS02-D02",
      "file": "links.ts",
      "function": "createLink",
      "line": 82,
      "anchor": "links.set(code, link);",
      "class": "design",
      "category": "logic-error",
      "cwe": "CWE-706",
      "title": "New links silently overwrite existing codes",
      "description": "createLink() stores the link without checking whether the code (alias or generated) already exists, so anyone can repoint an existing short link.",
      "trigger": "POST /shorten {\"alias\":\"docs\",...} twice with different urls",
      "observed": "Second request returns 201 and /r/docs now redirects to the second url.",
      "repro": "alias_overwrite"
    },
    {
      "id": "TS02-D03",
      "file": "links.ts",
      "function": "validateTarget",
      "line": 44,
      "anchor": "new URL(target);",
      "class": "vulnerability",
      "category": "open-redirect",
      "cwe": "CWE-601",
      "title": "Any URL scheme accepted as a redirect target",
      "description": "validateTarget() only checks that the string parses as a URL, so javascript:, data: and file: targets are stored and served in the Location header.",
      "trigger": "POST /shorten {\"url\":\"javascript:alert(document.cookie)\"} then GET /r/:code",
      "observed": "302 with Location: javascript:alert(document.cookie).",
      "repro": "javascript_redirect"
    },
    {
      "id": "TS02-D04",
      "file": "server.ts",
      "function": "recordClick",
      "line": 78,
      "anchor": "link.clicks = clicks + 1;",
      "class": "design",
      "category": "race-condition",
      "cwe": "CWE-362",
      "title": "Click counter loses concurrent updates",
      "description": "recordClick() reads link.clicks, awaits the log append, then writes the stale value + 1; concurrent redirects overwrite each other's increments.",
      "trigger": "200 concurrent GET /r/:code requests",
      "observed": "All 200 redirects succeed but stats report far fewer clicks.",
      "repro": "click_lost_update"
    },
    {
      "id": "TS02-D05",
      "file": "links.ts",
      "function": "clicksPerDay",
      "line": 100,
      "anchor": "return Math.round((clicks / days) * 100) / 100;",
      "class": "bug",
      "category": "division-by-zero",
      "cwe": "CWE-369",
      "title": "Clicks per day divides by zero on the creation day",
      "description": "clicksPerDay() divides by the number of full days since creation, which is 0 for the first 24 hours; the Infinity/NaN result is serialised as null.",
      "trigger": "Create a link, click it once, GET /stats/:code",
      "observed": "clicksPerDay is null.",
      "repro": "clicks_per_day_div_zero"
    },
    {
      "id": "TS02-D06",
      "file": "server.ts",
      "function": "handleAdminDelete",
      "line": 20,
      "anchor": "const ADMIN_TOKEN = \"sl-admin-7f3c9e21\";",
      "class": "vulnerability",
      "category": "hardcoded-secret",
      "cwe": "CWE-798",
      "title": "Admin endpoint guarded by a hardcoded token",
      "description": "handleAdminDelete() authorises anyone whose X-Admin header equals a constant compiled into the source.",
      "trigger": "POST /admin/delete with X-Admin set to the constant from server.ts",
      "observed": "200 and the link is deleted.",
      "repro": "hardcoded_admin_token"
    },
    {
      "id": "TS02-D07",
      "file": "links.ts",
      "function": "normalizeAlias",
      "line": 63,
      "anchor": "const canonical = alias.toLowerCase();",
      "class": "bug",
      "category": "logic-error",
      "cwe": null,
      "title": "Aliases lowercased on creation but looked up verbatim",
      "description": "normalizeAlias() stores aliases in lower case, but resolveLink() looks the code up exactly as requested, so the alias a user chose does not resolve.",
      "trigger": "POST /shorten {\"alias\":\"Promo\"} then GET /r/Promo",
      "observed": "Code returned is 'promo'; GET /r/Promo is 404.",
      "repro": "alias_case_lookup"
    },
    {
      "id": "TS02-D08",
      "file": "links.ts",
      "function": "normalizeAlias",
      "line": 64,
      "anchor": "return canonical.slice(0, CODE_LENGTH);",
      "class": "bug",
      "category": "off-by-one",
      "cwe": "CWE-193",
      "title": "Eight-character aliases are truncated to seven",
      "description": "validateAlias() accepts aliases up to MAX_ALIAS_LENGTH (8) characters, but normalizeAlias() slices to CODE_LENGTH (7), so a valid 8-character alias is silently shortened.",
      "trigger": "POST /shorten {\"alias\":\"spring24\"}",
      "observed": "201 with code 'spring2'; GET /r/spring24 is 404.",
      "repro": "alias_truncated"
    },
    {
      "id": "TS02-D09",
      "file": "links.ts",
      "function": "isExpired",
      "line": 87,
      "anchor": "return link.expiresAt !== null && link.expiresAt < now;",
      "class": "bug",
      "category": "logic-error",
      "cwe": "CWE-613",
      "title": "Expired links keep resolving (seconds vs milliseconds)",
      "description": "createLink() stores expiresAt in milliseconds while handleRedirect() passes nowSeconds(); isExpired() compares the two, so a link never expires.",
      "trigger": "POST /shorten {\"ttlSeconds\":1}, wait 2 s, GET /r/:code",
      "observed": "Still 302 to the target.",
      "repro": "expired_link_resolves"
    },
    {
      "id": "TS02-D10",
      "file": "server.ts",
      "function": "fetchPreview",
      "line": 68,
      "anchor": "const res = await fetch(target, { signal: AbortSignal.timeout(3000) });",
      "class": "vulnerability",
      "category": "ssrf",
      "cwe": "CWE-918",
      "title": "Link preview fetches arbitrary internal URLs",
      "description": "fetchPreview() requests any submitted URL from the server, including loopback and private addresses, and returns the first 200 bytes of the response.",
      "trigger": "POST /shorten {\"url\":\"http://127.0.0.1:<internal>/latest/meta-data\",\"preview\":true}",
      "observed": "201 with a preview snippet containing the internal service's response body.",
      "repro": "preview_ssrf"
    },
    {
      "id": "TS02-D11",
      "file": "links.ts",
      "function": "linkStats",
      "line": 104,
      "anchor": "const link = links.get(code) as Link;",
      "class": "bug",
      "category": "null-dereference",
      "cwe": "CWE-476",
      "title": "Stats for an unknown code dereference undefined",
      "description": "linkStats() casts the Map lookup to Link and reads its fields without handling a missing code.",
      "trigger": "GET /stats/doesnotexist",
      "observed": "500 internal error instead of 404.",
      "repro": "stats_unknown_code"
    }
  ]
}
