{
  "specimen": "py-02-report-cli",
  "language": "python",
  "kind": "cli",
  "summary": "CSV timesheet billing report: per-worker hours, amounts, overtime and a post-processing line count.",
  "defects": [
    {
      "id": "PY02-D01",
      "file": "report.py",
      "function": "render",
      "line": 66,
      "anchor": "hours * rate",
      "class": "bug",
      "category": "float-money",
      "cwe": "CWE-681",
      "title": "Billing amounts are computed in binary floating point",
      "description": "render parses --rate as float and multiplies hours * rate, so amounts print with binary-float artefacts instead of exact currency.",
      "trigger": "python3 report.py --input <3h csv> --rate 0.1",
      "observed": "Report line 'amount: $0.30000000000000004' for 3 hours at rate 0.1.",
      "repro": "float_amounts"
    },
    {
      "id": "PY02-D02",
      "file": "timesheet.py",
      "function": "share_of_total",
      "line": 25,
      "anchor": "part / whole",
      "class": "bug",
      "category": "division-by-zero",
      "cwe": "CWE-369",
      "title": "Overtime percentage divides by the worker's total minutes",
      "description": "share_of_total divides by the worker's total; a worker whose rows sum to 0 minutes raises ZeroDivisionError and crashes the run.",
      "trigger": "CSV where a worker's rows are all 0m",
      "observed": "The CLI exits non-zero with a ZeroDivisionError traceback and writes no report.",
      "repro": "zero_total_worker"
    },
    {
      "id": "PY02-D03",
      "file": "report.py",
      "function": "post_process",
      "line": 81,
      "anchor": "f\"wc -l {out_path}\"",
      "class": "vulnerability",
      "category": "command-injection",
      "cwe": "CWE-78",
      "title": "The --out path is interpolated into a shell command",
      "description": "post_process builds 'wc -l <out>' as a shell string, so shell metacharacters in --out execute arbitrary commands.",
      "trigger": "--out 'rep.txt; echo INJECTED > marker.txt'",
      "observed": "marker.txt containing INJECTED is created next to the report.",
      "repro": "out_arg_injection"
    },
    {
      "id": "PY02-D04",
      "file": "report.py",
      "function": "parse_row",
      "line": 31,
      "anchor": "row[3]",
      "class": "bug",
      "category": "out-of-bounds",
      "cwe": "CWE-129",
      "title": "Row parser indexes the duration column without checking the width",
      "description": "parse_row reads row[3] unconditionally, so a row with only 3 columns raises IndexError.",
      "trigger": "CSV row 'zed,2026-09-14,p'",
      "observed": "IndexError inside parse_row.",
      "repro": "short_row_index"
    },
    {
      "id": "PY02-D05",
      "file": "timesheet.py",
      "function": "overtime_minutes",
      "line": 31,
      "anchor": "daily_minutes[1:]",
      "class": "bug",
      "category": "off-by-one",
      "cwe": "CWE-193",
      "title": "Overtime skips the first day of the period",
      "description": "overtime_minutes iterates daily_minutes[1:], so overtime worked on the first recorded day is never counted.",
      "trigger": "overtime_minutes([600, 100], 480)",
      "observed": "Returns 0 although the first day has 120 minutes of overtime.",
      "repro": "first_day_skipped"
    },
    {
      "id": "PY02-D06",
      "file": "timesheet.py",
      "function": "parse_duration",
      "line": 7,
      "anchor": "re.compile(r\"^(-?\\d+h?)*(-?\\d+m?)*$\")",
      "class": "vulnerability",
      "category": "redos",
      "cwe": "CWE-1333",
      "title": "Duration validation regex backtracks catastrophically",
      "description": "DURATION_RE nests quantified groups, so a long non-matching duration such as 24 digits followed by 'x' takes exponential time to reject.",
      "trigger": "parse_duration('111111111111111111111111x')",
      "observed": "Does not finish within 5 seconds while valid durations parse instantly.",
      "repro": "duration_regex_hang"
    },
    {
      "id": "PY02-D07",
      "file": "report.py",
      "function": "load_entries",
      "line": 44,
      "anchor": "except Exception:",
      "class": "design",
      "category": "error-handling",
      "cwe": "CWE-755",
      "title": "A bad row silently truncates the timesheet",
      "description": "load_entries catches every exception and breaks out of the loop, then the report is written and the program exits 0 with later rows missing.",
      "trigger": "CSV with an invalid duration on a middle row",
      "observed": "Exit status 0 and a report that silently omits every row after the bad one.",
      "repro": "silent_truncation"
    },
    {
      "id": "PY02-D08",
      "file": "timesheet.py",
      "function": "parse_duration",
      "line": 18,
      "anchor": "minutes *= 60",
      "class": "bug",
      "category": "missing-precondition",
      "cwe": "CWE-20",
      "title": "Negative durations are accepted",
      "description": "The duration grammar admits a leading '-', and parse_duration never requires a positive total, so '-2h' contributes -120 minutes.",
      "trigger": "CSV row with duration '-2h'",
      "observed": "The worker's total is reduced: -2h + 8h reports 6.00 hours.",
      "repro": "negative_duration"
    },
    {
      "id": "PY02-D09",
      "file": "timesheet.py",
      "function": "is_weekend",
      "line": 39,
      "anchor": "day.weekday() > 5",
      "class": "bug",
      "category": "logic-error",
      "cwe": "CWE-682",
      "title": "Saturday is not counted as weekend work",
      "description": "is_weekend uses weekday() > 5, which only matches Sunday; Saturday work is reported as regular time.",
      "trigger": "CSV row on a Saturday",
      "observed": "Report shows 'weekend: 0h00m' for a worker with 2h logged on a Saturday.",
      "repro": "saturday_not_weekend"
    }
  ]
}
