{
  "specimen": "go-01-inventory-api",
  "language": "go",
  "kind": "web",
  "summary": "Loopback warehouse service for stock, reservations, reporting, and item search.",
  "defects": [
    {
      "id": "GO01-D01",
      "file": "handlers.go",
      "function": "reserveHandler",
      "line": 95,
      "anchor": "stock := item.Stock",
      "class": "design",
      "category": "race-condition",
      "cwe": "CWE-362",
      "title": "Concurrent reservations oversubscribe stock",
      "description": "reserveHandler reads stock and later writes a derived value without synchronizing access to the item, allowing concurrent requests to pass the same availability check.",
      "trigger": "Create an item with stock 10 and send 50 concurrent reservations for one unit.",
      "observed": "More than 10 requests succeed or the final stock value becomes negative.",
      "repro": "parallel_reserve"
    },
    {
      "id": "GO01-D02",
      "file": "handlers.go",
      "function": "restockHandler",
      "line": 133,
      "anchor": "item.Stock += input.Packs * input.PerPack",
      "class": "bug",
      "category": "integer-overflow",
      "cwe": "CWE-190",
      "title": "Bulk restock wraps the stock counter",
      "description": "The pack multiplication and addition use int32 arithmetic and can wrap the stored stock count.",
      "trigger": "Restock an empty item with 50000 packs of 50000 units.",
      "observed": "The returned stock count is negative after the multiplication wraps.",
      "repro": "bulk_overflow"
    },
    {
      "id": "GO01-D03",
      "file": "handlers.go",
      "function": "releaseHandler",
      "line": 117,
      "anchor": "item.Reserved -= input.Qty",
      "class": "bug",
      "category": "invariant-violation",
      "cwe": "CWE-20",
      "title": "Release accepts more units than reserved",
      "description": "The release path subtracts the requested quantity from reservations and adds it to stock without checking the reserved balance.",
      "trigger": "Reserve two units and release five.",
      "observed": "The response contains reserved=-3 and stock=13 for an item that began with stock 10.",
      "repro": "excess_release"
    },
    {
      "id": "GO01-D04",
      "file": "handlers.go",
      "function": "itemHandler",
      "line": 44,
      "anchor": "sku := pathParts[3]",
      "class": "bug",
      "category": "out-of-bounds",
      "cwe": "CWE-129",
      "title": "Short item paths panic during lookup",
      "description": "The item handler indexes the split path before confirming that the SKU segment exists.",
      "trigger": "Send GET /items.",
      "observed": "The server log records an index out of range panic for the request.",
      "repro": "short_item_path"
    },
    {
      "id": "GO01-D05",
      "file": "calc.go",
      "function": "reorderPoint",
      "line": 12,
      "anchor": "return total / int32(len(locations))",
      "class": "bug",
      "category": "division-by-zero",
      "cwe": "CWE-369",
      "title": "Reorder point divides by an empty location count",
      "description": "The calculation divides stock by the number of locations without handling an empty location list.",
      "trigger": "Create an item with no locations and request its item view.",
      "observed": "The server log records an integer divide by zero panic.",
      "repro": "empty_location_average"
    },
    {
      "id": "GO01-D06",
      "file": "handlers.go",
      "function": "viewItem",
      "line": 80,
      "anchor": "SupplierName: item.Supplier.Name",
      "class": "bug",
      "category": "null-dereference",
      "cwe": "CWE-476",
      "title": "Item view dereferences an absent supplier",
      "description": "The item view accesses the supplier name even when the optional supplier pointer is nil.",
      "trigger": "Create an item without a supplier and request its item view.",
      "observed": "The server log records a nil pointer dereference panic.",
      "repro": "missing_supplier_view"
    },
    {
      "id": "GO01-D07",
      "file": "handlers.go",
      "function": "reportHandler",
      "line": 143,
      "anchor": "items = items[:limit]",
      "class": "bug",
      "category": "out-of-bounds",
      "cwe": "CWE-129",
      "title": "Report limit is used as an unchecked slice bound",
      "description": "The report handler slices the inventory with the supplied limit without checking its range.",
      "trigger": "Request /report?limit=100 when fewer than 100 items exist.",
      "observed": "The server log records a slice bounds out of range panic.",
      "repro": "report_limit"
    },
    {
      "id": "GO01-D08",
      "file": "main.go",
      "function": "auditRequests",
      "line": 33,
      "anchor": "file, _ := os.OpenFile",
      "class": "bug",
      "category": "resource-leak",
      "cwe": "CWE-775",
      "title": "Request audit files remain open",
      "description": "Each request opens the audit file and leaves the descriptor open after writing its entry.",
      "trigger": "Measure the server process file descriptor count and issue 25 search requests.",
      "observed": "The open descriptor count grows with the number of requests.",
      "repro": "request_fd_growth"
    },
    {
      "id": "GO01-D09",
      "file": "handlers.go",
      "function": "createItem",
      "line": 60,
      "anchor": "json.Unmarshal(body, &input)",
      "class": "bug",
      "category": "error-handling",
      "cwe": "CWE-252",
      "title": "Malformed item JSON is accepted",
      "description": "The create handler discards the JSON decoding error and proceeds with the zero-valued request.",
      "trigger": "Send a malformed JSON body to POST /items.",
      "observed": "The server returns HTTP 201 with an item whose SKU is empty.",
      "repro": "malformed_item_json"
    },
    {
      "id": "GO01-D10",
      "file": "handlers.go",
      "function": "searchHandler",
      "line": 163,
      "anchor": "fmt.Fprintf(w, \"<!doctype html><html><body>%s</body></html>\", query)",
      "class": "vulnerability",
      "category": "xss",
      "cwe": "CWE-79",
      "title": "Search query is returned as active markup",
      "description": "The search endpoint places the caller's query directly in an HTML response.",
      "trigger": "Request /search?q=%3Cscript%3Ealert(7)%3C/script%3E.",
      "observed": "The response has a text/html content type and contains the script element unchanged.",
      "repro": "search_markup"
    },
    {
      "id": "GO01-D11",
      "file": "main.go",
      "function": "main",
      "line": 9,
      "anchor": "const adminToken = \"warehouse-control-8331\"",
      "class": "vulnerability",
      "category": "hardcoded-secret",
      "cwe": "CWE-798",
      "title": "Reset credential is stored in source",
      "description": "The request credential accepted by the reset endpoint is declared directly in the application source.",
      "trigger": "Read the token declaration and send it as X-Admin-Token to POST /admin/reset.",
      "observed": "The reset request returns HTTP 204.",
      "repro": "source_token_reset"
    }
  ]
}
